{
    "gate_id":  "DEMO-DAY1-GATE",
    "run_id":  "day1-20260823-102332",
    "readme_version":  "0.23.0-draft",
    "started_at":  "2026-08-23T01:23:32Z",
    "completed_at":  "2026-08-23T01:23:58Z",
    "verifier":  {
                     "context":  "scripts/verify-day1.ps1 결정형 검사",
                     "is_separate_from_implementer":  false
                 },
    "source_snapshot":  {
                            "file_count":  45,
                            "combined_sha256":  "838956d84dfd0ffd74cb6c19b085fce297f29f32fb000c124d582ed91e6811f0",
                            "files":  [
                                          {
                                              "path":  "backend/app/__init__.py",
                                              "sha256":  "e3b0c44298fc1c149afbf4c8996fb92427ae41e4649b934ca495991b7852b855"
                                          },
                                          {
                                              "path":  "backend/app/agents/__init__.py",
                                              "sha256":  "e3b0c44298fc1c149afbf4c8996fb92427ae41e4649b934ca495991b7852b855"
                                          },
                                          {
                                              "path":  "backend/app/agents/fact_extraction.py",
                                              "sha256":  "9ae54a8f23c97ea5b0c9444c393db6dd3346371513aca80daa72cb318ee849b0"
                                          },
                                          {
                                              "path":  "backend/app/api/__init__.py",
                                              "sha256":  "e3b0c44298fc1c149afbf4c8996fb92427ae41e4649b934ca495991b7852b855"
                                          },
                                          {
                                              "path":  "backend/app/api/runs.py",
                                              "sha256":  "01fa900b01b524dc40776cdec77672ff2105dfdc7cec3e40887156cbec741b5b"
                                          },
                                          {
                                              "path":  "backend/app/gates/__init__.py",
                                              "sha256":  "e3b0c44298fc1c149afbf4c8996fb92427ae41e4649b934ca495991b7852b855"
                                          },
                                          {
                                              "path":  "backend/app/gates/conflict_gate.py",
                                              "sha256":  "6778aea60adc9e4c3f2f5205bac3a4d27113bfba1d13e133f7af178062b1e384"
                                          },
                                          {
                                              "path":  "backend/app/gates/evidence_gate.py",
                                              "sha256":  "bfd89b059718695fb5546c22f05bbb397847961c11ccc73e818c0a73e4613128"
                                          },
                                          {
                                              "path":  "backend/app/gates/input_gate.py",
                                              "sha256":  "69faf53ee7f63da367c6c510f85549b0edf181f0237f59ada7ed9cf06e3f824e"
                                          },
                                          {
                                              "path":  "backend/app/gates/source_role_gate.py",
                                              "sha256":  "36cd3c0c0d14119fa42b04ca73c6e39a7cd9271ee560b142019b975ceecbe8b8"
                                          },
                                          {
                                              "path":  "backend/app/harness/__init__.py",
                                              "sha256":  "e3b0c44298fc1c149afbf4c8996fb92427ae41e4649b934ca495991b7852b855"
                                          },
                                          {
                                              "path":  "backend/app/harness/contract_loader.py",
                                              "sha256":  "a49a8ed1b9d204d4fdfdef91fab4d914f0ececca971bdd5630cbfa9a8d33383a"
                                          },
                                          {
                                              "path":  "backend/app/harness/contracts.py",
                                              "sha256":  "cd3a8033751f78ea94ae144c43e93ba1428dd1de4694f71d0527f19c62ce6b2b"
                                          },
                                          {
                                              "path":  "backend/app/harness/fact_contracts.py",
                                              "sha256":  "4ad373d76c71a1eae94210ae469f8291d538933ac74c0bb4ce50ed7e238385e0"
                                          },
                                          {
                                              "path":  "backend/app/harness/orchestrator.py",
                                              "sha256":  "efbb0711f315f77fcbe244b1203d197f8e09fd12b333a053c9bd18d23e290eda"
                                          },
                                          {
                                              "path":  "backend/app/harness/runtime.py",
                                              "sha256":  "adb8394f5c16e73ad4969e14f62940d7a82c6177fb7f328422e1cbd417a24b2c"
                                          },
                                          {
                                              "path":  "backend/app/harness/source_normalizer.py",
                                              "sha256":  "dd1d9513b6598f94fd7f8430283c38270211b5341c4143898069869839f9713d"
                                          },
                                          {
                                              "path":  "backend/app/harness/states.py",
                                              "sha256":  "a75afd52f696b966b507326ba31e1dc42976986ec50b1dfb015cd2c428adad03"
                                          },
                                          {
                                              "path":  "backend/app/infrastructure/__init__.py",
                                              "sha256":  "e3b0c44298fc1c149afbf4c8996fb92427ae41e4649b934ca495991b7852b855"
                                          },
                                          {
                                              "path":  "backend/app/infrastructure/fake_agents.py",
                                              "sha256":  "4d3d97e684c38c4a8f958db7794d3d3f821dacaba7081edf7448c736f6891589"
                                          },
                                          {
                                              "path":  "backend/app/infrastructure/model_gateway.py",
                                              "sha256":  "ec8804f1b6949a0a6dc53b04cbb279946140535fd8728737eb4791f128eace1e"
                                          },
                                          {
                                              "path":  "backend/app/infrastructure/run_store.py",
                                              "sha256":  "518fea31c2af082ca83333c03bcf6ae4563131135dda07455d67cc337fac984a"
                                          },
                                          {
                                              "path":  "backend/app/main.py",
                                              "sha256":  "e5b6bb9719b1acc89f337e4d7c569fd2d836d95c3c9049c598d1ccf408ce6c76"
                                          },
                                          {
                                              "path":  "backend/app/writing_contracts/assembly_law_amendment_v1/contract.yaml",
                                              "sha256":  "9065fa6d7d3f31d8d487517ef43c770a1003aec034d099ab21eadf579a5af6bc"
                                          },
                                          {
                                              "path":  "backend/app/writing_contracts/assembly_law_amendment_v1/profile.yaml",
                                              "sha256":  "29c13548a7504677bf12dd80016c989071d8fb1b37cd557527b812f5237a507c"
                                          },
                                          {
                                              "path":  "backend/app/writing_contracts/assembly_law_amendment_v1/style.yaml",
                                              "sha256":  "13434349ee3564b2fd389889eb4e1cd286ca4d618466435ceef4fc57dd7cb9ba"
                                          },
                                          {
                                              "path":  "backend/app/writing_contracts/assembly_law_amendment_v1/template.yaml",
                                              "sha256":  "0fe4f17dd0d01e1cb6255fd4e541a102ccedde6891f9a6933749b7e5e980c7ef"
                                          },
                                          {
                                              "path":  "backend/app/writing_contracts/assembly_law_amendment_v1/validation.yaml",
                                              "sha256":  "fa672e462157407ab4edb70965cbbf34ce69febdc4e87a2c079419fb0b2246bf"
                                          },
                                          {
                                              "path":  "frontend/src/api/client.ts",
                                              "sha256":  "d7642940572b68e3f8fcf4f495584f8bb3817bad4a861a0f9b0688513765d401"
                                          },
                                          {
                                              "path":  "frontend/src/App.test.tsx",
                                              "sha256":  "028195da963747366c0cdcefa640ad24079c622c835ce48465c6321a76b3dc1b"